URL,Headline,Date1,Date2,Content,Author
https://tribune.com.pk/story/1456255/yeh-bik-gayi-gormint/,'Yeh bik gayi hai gormint',2017-07-12T10:45:02 GMT,"Published: July 12, 2017","The Sharif­s should have at least preten­ded they won ‘Who Wants to a Millio­naire’ a few hundre­d times

I am a lawyer who decided to be a comedian. I never thought my two worlds would collide so perfectly one day. I have used all of my legal knowledge and gone through the Joint Investigation Team (JIT) recently revealed report and now, I am going to translate it into Pakistani – a language all of us understand.

The JIT was formed to find what the sources of funds are

Translation: We wanted everybody to know conclusively how the Sicilian mafia works before making any decision. Hey – we are the Supreme Court – when have we ever taken haste in dismissing a government or legitimising an illegal government? We are completely independent of politics – look at JIT to keep you occupied!

The affidavits of Tariq Shafi are unreliable. His signatures are different

Translation: How lazy are you man? If you were going to forge documents, you should have at least signed all of them yourself. You made other people sign! You truly do live like a king.

The Ahli Steel Mills document does not exist

Translation: Nawaz Sharif claims his dog ate his office work.

Tariq Shafi said Shehbaz Sharif was involved. Shehbaz Sharif said he was not involved

Translation: Aah… another case of he said, Shah said – Shehbaz Sharif is lying and trying to ensure he does not go down with his brother. He is building an underpass for himself to get out of this flood but he will drown with the rest of them.

As ministers bash JIT, PM confers with top aides

No document proving business started with 100% loan

Translation: Chori ka paisa hoga.

The liabilities of Gulf Steel were cleared possibly through undeclared wealth

Translation: Please refer to the aforementioned chori ka paisa.

No document shown to prove how money reached Qatar, Jeddah, or UK

Translation: The Sharif family is engaged in something that rhymes with funny maundering – yes, it is money laundering. You win nothing – just like the Sharif family from this JIT.

The liabilities repayment would have wiped out any sale proceeds

Translation: Chori ka paisa + chori ka paisa – chori ka paisa x chori ka paisa = chori ka paisa.

Mian Muhammad Nawaz Sharif during his address to the nation stated that in 1980 this factory (Gulf Steel Mills) was sold for AED 33.7 million. This is not consistent with either the documents/records provided by the respondents or the findings of the JIT

Translation: So, if anybody wants to file an application declaring him to be not ‘sadiq and ameen’ and not fit to be a prime minister, we are ready to hear you out.

Moreover, no Imran Khan, we do not mean physically, is fit to be the premier – stop with the push-ups already.

Respondents story about Gulf is unauthentic, lacks substance and seems fabricated

Translation: Just like everything else they say – ye bhi jhoot hay.

JIT suggests filing NAB reference against Sharif family

Sales proceeds from Gulf Steel Mills never reached Jeddah, Qatar or UK

Translation: The Sharif family should have at least pretended they won “Who Wants to a Millionaire” a few hundred times.

The beneficial owner of the Neilson Enterprises Limited and the Nescoll Limited is Maryam Safdar

Translation: The Sharif family should have thought about protecting Maryam when they were distributing properties in London like it was candy to all of their children.

Maryam has submitted fake/falsified documents to the JIT, which is a criminal offence. Mr Hussain Nawaz and Captain Safdar have also signed these documents

Translation: At least the Sharifs will have company in jail.

Comprehensive report duly signed by Robert W. Radley(Radley Forensic Document Laboratory) London “I have identified the type font used to produce both certified declarations to be “Calibri”. However, “Calibri” was not commercially available before 31st January 2007 and as such, neither of the originals of the certified Declarations is correctly dated and happy to have been created at some later point in time”

Translation: The Sharifs clearly did not learn in school that ‘naql’ kay liye bhi ‘aqal’ chaiye hoti hay.

Mr Nawaz distanced himself from the apartments

Translation: Even the father who gave them the property does not want to get involved in the mess. Is the court to believe Hussain Nawaz invented Facebook and became a billionaire while he was a teenager thus was able to afford all these properties?

Complete JIT report on Sharifs’ offshore properties

Repeated changes in Hussain Nawaz’s stance indicates possible efforts to conceal facts

Translation: Jhoot pakra gaya.

True owners of the Sharif family were the Sharif family – Nawaz seems to employ his children and two BVI entities to conceal his true ultimate ownership

Translation: Like you know, like every wealthy Pakistani father.

“Mr Hasan Nawaz, in his statement before the JIT, explained that Mr Hussain Nawaz Sharif had sent him 2.4 million GBP to help him set his business without declaring the source where the money was coming from”

Translation: 324386304.00 Pakistani rupees. We are sure Hussain Nawaz earned this through his tech start-up. Sure 320 million can sustain thousands of livelihoods for years in Pakistan but it is peanuts for the Sharif family.

Hasan Nawaz and Hussain Nawaz did not have any independent source of income till 2000

Translation: Yet he was distributing millions like Edhi.

Shahbaz Sharif’s reluctance to discuss Qatari letters

Translation: The junior Sharif thinks he will be able to get out of this sinking ship, or at least Hamza will be the next chief minister of Punjab but we are onto him. He goes down with the rest of him.

Al Thani Family did not own the Mayfair apartments

Translation: Qatar cannot even save them now.

Confirmation of fictitious sale/purchase agreements by the respondents

Translation: Yeh bik gayi hai gormint.

The basic summary of the JIT recommendations is that sab hie chor hain, sab hie jhootay hain.

This article is a work of satire.

Read full story",Shehzad Ghias
https://tribune.com.pk/story/1437071/myanmar-editor-facing-trial-posting-satirical-article-defaming-military/,Myanmar editor facing trial for posting satirical article defaming military,2017-06-16T07:10:37 GMT,"Published: June 16, 2017","Activi­sts say variou­s defama­tion laws are being used to stifle free speech­

YANGON, MYANMAR: The editor of one of Myanmar’s top newspapers will face trial for defaming the military by posting a satirical article on Facebook, under a controversial law critics say is stifling press freedom.

Myanmar anti-Islam monk says barred from Facebook

Last month the army sued the editor in chief of The Voice, Kyaw Min Swe, for uploading a link to an article poking fun at the military’s leaders for sitting around talking while ordinary soldiers are killed. On Friday a court in Yangon sent him to the city’s notorious Insein prison to await the start of his trial next week.

Hopes had been high that Myanmar’s first freely elected government in generations would usher in a new era of free speech when they took power last year after half a century of military rule. But defamation prosecutions have soared since Aung San Suu Kyi’s National League for Democracy (NLD) came to power, with social media satirists, activists and journalists increasingly targeted.

Activists say various defamation laws are being used to stifle free speech and stop the media from criticising the government.

Kyaw Min Swe is being prosecuted under the country’s broadly-worded telecommunications law — known as “66(d)” — which forbids uploading false of defamatory information online. If convicted he faces up to six months in jail.

The writer of the article, Kyaw Swa Naing, was acquitted by the court on Friday because he did not actually upload his piece. Speaking to reporters outside court, he said the law “must be amended”.

“Journalists are being harmed very much. Although we do not know what the verdict will be for brother Kyaw Min Swe… he’s now being held in prison,” he added.

Dozens of journalists and free speech activists wearing white armbands and with painted faces protested near the court on Friday, displaying banners emblazoned with “press freedom” in red.

“The government is letting people and organisations sue journalists… using a (law) that should be abolished under the NLD,” protesters Phyo Wai said.

Facebook ‘ban’ of anti-Muslim slur sparks Myanmar outcry

The Voice article at the centre of the case poked fun at a military propaganda film called “Pyi Daung Su Thit Sar” (Faithful to the Union) lauding the army’s victories over armed ethnic groups.

It was released just weeks before the start of the government’s latest round of tense peace negotiations with Myanmar’s myriad insurgent groups, and as some of the heaviest fighting in decades rages in border areas.

Read full story",AFP 
https://tribune.com.pk/story/1418795/party-strategies-2018-general-elections-leaked/,Party strategies for 2018 general elections leaked,2017-06-06T09:19:08 GMT,"Published: June 6, 2017","Read the propos­ed pathwa­ys of PML-N, PTI, PPP and others to their possib­le victor­ies and pick your winner­

The run-up to Pakistan’s upcoming general elections next year have taken an interesting turn, as election campaigns of Pakistan’s leading political parties have been leaked. Read the proposed pathways of PML-N, PTI, PPP and others to their possible victories and pick your winner.

Pakistan Muslim League-Nawaz (PML-N)

Politics is temporary but Biryani is forever. We survived the past five years and so did you, let’s survive five more together. No more Panama, only nara pajama.

We promise to make more roads and import fancy buses to make it seem like the country is progressing. Look at all our metro buses; we are the most metrosexual party ever. Load-shedding will be over by 2019 promise, pinky promise.

No JIT can bring us down. Unless it is more than two hours, then Hussain Nawaz gets tired.

Elections 2018: ‘Make resolution of people’s issues a priority’

Just don’t look at all these flats we are buying around the world – those are just in case papa decides democracy time is over and we all need to stop pretending. Load-shedding will be over by 2020 promise, pinky promise. Maryam Nawaz > Hamza Shahbaz.

Promise everything and deliver nothing. Load-shedding will be over by 2021 promise, pinky promise.

When you’re with us, you’re family. Do your corruption. Do your murders. Do your terrorism. As long as nobody reports about anything, we won’t care. Just continue voting for us. As long as we have Punjab, we have nothing to worry about.

Remember when Shahbaz said he would drag Asif Ali Zardari through the streets? You have to give us five more years if you want to see that happen – we are saving that for the DVD special. Maryam Nawaz’s twitter > Imran Khan’s twitter

Load-shedding will be over by 2099 promise, pinky promise.

Pakistan Tehreek-e-Insaf (PTI)

Imran Khan is neither Asif Ali Zardari nor Nawaz Sharif. Wait, what? You need more reasons to vote for us? Well, do we need to stand for anything when we can simply stand against everything?

The only tabdeeli that comes is the one in our political positions.

We have figured out what you don’t want. We have no idea what you want or how to even give it to you but, we agree with you that we don’t want what you don’t want as well so, we are on the same page then. All we know is that tabdeeli is coming; we have no idea what will happen when it is here.

How PML-N’s trying to win voter support in 2018 elections

Nobody cares if our party has the same guys as all the other parties just look at how beautiful Imran Khan is and he is single again. Nobody was going to vote for a 64-year-old married man.

Are you an electable? JOIN PTI! We can deal with your criminal records; corruption and complete lack of principles later, just get elected for now.

We will fight corruption because Imran Khan isn’t corrupt. Such logic, much wow.

We will fight terrorism because Imran Khan isn’t a terrorist.

We will fight India because Imran Khan isn’t an Indian.

So, basically just forget all policy and agenda items and just look at Imran Khan. Do you like what you see? Vote for us then! You don’t even need to know our names, just vote for the bat.

Also, the best jalsas. By far.

Don’t trust Javed Hashmi when he says the plan is to get two-three people killed. Trust us, we cannot win an election by just getting two-three people killed, more like 20-30 maybe.

Also Twitter trolls. So, so, so, many Twitter trolls. Facebook ka Prime Minister is a legit position ok.

Pakistan People’s Party (PPP)

Have you all forgotten the period of 2008 to 2013? Great! Then we are back again. Let’s pretend Asif Ali Zardari was never the president.

You know how sometimes you have a headache but then you get cancer for a few years and you forget that you ever had a headache because cancer hurts so much now? Well, the headache is back and after cancer, it doesn’t seem that bad.

Also look at how shiny Bilawal Bhutto is. He even speaks Urdu now – or what he thinks is Urdu. In the next update, we will also try to make him speak Sindhi.

Nawaz Sharif foreseen to win 2018 polls: report

Want to know what he stands for and what his policies are? He is Benazir’s son and Zulfiqar Ali Bhutto’s grandson. Want to know what PPP will do once the party comes into power? Have we told you who Bilawal’s mother and grandfather are?

What are going to be our major campaign ideas? What? Do you want me to draw the Bhutto family tree for you? Also, we have the best political song. Admit it – you want to dance to it on your mehndi also. And of course, the most holidays because we have the most shaheeds.

Make Pakistan great again. Go back to the days when we got 10% of everything.

Also Zinda hay Bilawal – wait it was a secret Zardari strategy that was not supposed to be leaked.

Muttahida Qaumi Movement (MQM)

We exist. No promise we are still a political reality. Remember the days we complained that we had our backs against the wall? Well now that we are giving Anarkali Company inside the wall that doesn’t seem that bad.

BUT…hey look at how we were victimised, if nothing else, have some sympathy and give us your cell phones, I mean votes. I swear, we meant votes.

Musharraf likely to contest 2018 general elections

Why are you even looking for campaign ideas? When have we ever had any? Just look at what your identity is and vote for it. If you don’t, we will send our karkun and they will vote on your behalf.

Also, don’t forget to take your CNICs back from us the day after elections. We can’t keep them forever – or maybe we can till, at least, the next Skype call from London.

We go from the wall to your Facebook wall. You know you want to share that cute Altaf Hussain video. The only thing more popular than puppies on social media are Altaf Bhai’s pappis – ek pappi idhar, ek pappi udhar.

Awami Muslim League (AML)

When you can buy the milk, why buy the Buffalo?

Jamaat-i-Islami (JI)

Look, we are PTI’s ally so we can’t be that bad right? And we are Islamic so if you are Muslim, you must vote for us.

We at least have an agenda. We oppose capitalism, communism, liberalism, socialism, secularism and Miley Cyrus. Mainly, Miley Cyrus – she has been used by the West as a wrecking ball against Pakistan. So what if Maududi opposed Jinnah and Pakistan. Pakistan exists now and we want some of that cake too now that it has been made.

Also, free ice cream for all the women (bought by their mehrams for them).

And no uncovered lollypops. Ever. Everyone except us is a kafir.

Jamiat Ulema-e-Islam Fazl (JUI-F)

What is our agenda? Depends – how much are you willing to pay?

Say no to Petrol. Only Diesel.

This article is a work of satire.

Read full story",Shehzad Ghias
https://tribune.com.pk/story/1412053/sneak-peak-cpec-master-plan/,A sneak peak into the ‘CPEC Master Plan’,2017-05-18T09:19:52 GMT,"Published: May 18, 2017","Karach­i will soon be called China Town under CPEC

Prime Minister Nawaz Sharif was recently in China to participate in the ‘One Belt, One Road’ summit, which is ironic since his name and the word belt have never been used in the same sentence before. Many people have to tie two belts together and a nara with izarband each time when choosing to wear a suit. The struggle is real, people, especially for our respected premier.

At great risk to my personal well-being, I somehow managed to stick my hand in the pocket of PM Nawaz’s suit shalwar and pull out the longest term plan for the China-Pak Economic Dumbledore, I mean Corridor. I uttered Dumbledore first because the way China has convinced us that the China-Pakistan Economic Corridor is a game-changer for Pakistan has to be magic. I would not be surprised if Chinese Prime Minister Li Keqiang tried giving Nawaz some ‘love potion’ the last time they met. There is a reason why their love is higher than the mountains and deeper than the seas, you know.

Pakistan highly attractive destination for investment: PM Nawaz

And guess what… the CPEC master plan revelations are truly shocking.

The Shan (soon to be called Shan-Ghai masalay) advertisement was just the start. The Chinese are planning to replace every kind of Biryani (mind you) in Pakistan with Chicken Manchurian. In many ways, the master plan is exactly like the advertisement; to lure neighbours into friendship with food. When the loving dadi in the advertisement tells the Chinese woman, “Isko apna hee ghar samjho”, she just smiles knowing that that was her plan all along.

You know Nawaz Sharif is involved when all it took to win people over was a plate of biryani – this is basically how he took office.

The CPEC master plan has a simple proposal for agriculture which can be summarised in just four words: We grow, they eat. Everyone who once laughed at the Chinese people for eating dogs will not be laughing anymore when they will end up eating all our crops.

The Chinese idea to increase agricultural exports to one of the most water-stressed countries in the world is genius! If all the water goes to the crops then none of the water will be left for drinking, which will cure all our population-related problems.

If the, soon to be implemented, one child per house Chinese policy does not seem to work in Pakistan then the scarcity of water will do the trick – and please. Don’t worry about how so many Chinese will fit in Pakistan because dil mai jaga honi chaiye, yaar.

China-Pakistan Economic Corridor: ‘Long-term plan’ to be inked soon

According to the plan, Karachi’s new name will be “China Town” and, in a reversal of fortune, Karachi will be the name of a restaurant in China Town. Lahore is to be called Lo Ho Ping, Gwadar is to be named Lo A Gaye Hum and Islamabad’s new name is Char Jao Ab Ling.

It is unclear what punishment the Chinese will give to those who shut down Chinese parlours in Islamabad. All the popular religious parties, who claimed communist parties could never win elections in Pakistan, are reportedly re-evaluating their beliefs.

The Chinese are also producing a sequel to the movie ‘Chalay thay saath’ now called ‘Chalay thay saath billion’. The movie revolves around sending the entire Chinese population into Pakistan and ends with the region being surrounded by the Great Wall of China. It is obviously fiction… for now.

The full surveillance system will ensure that Pakistanis do not do to the Great Wall of China what they do to every wall in the country. Huge sign boards saying saying ‘Great Wall of China par peshab karna mana hay’. In Mandarin. But that will not be a problem because soon it will be mandatory for all Pakistanis to learn Mandarin. The process has already started at primary schools.

The CPEC master’s master plan also reveals the internet in Pakistan will be replaced by cat videos. It envisions a deep and broad based penetration – which is what most Pakistani teenage boys also envision when they use the internet. No Facebook, Twitter or Instagram; the internet will just be billions and billions of cat videos.

The aim is replicate the calm that the people of Pakistan had when PTV was the only channel available. Just like Ayub Khan had videos of tractors everywhere. Even when the country was on the verge of a disaster, the nation remained calm because they watched videos teaching them how to drive tractors. What was the country’s domestic policy, you ask? People don’t know because when Pakistanis are driving tractors they are not thinking about the domestic policy.

In the same way, instead of worrying about their civil liberties and fundamental rights people will watch cat videos. The cuteness of the videos will distract them enough to forget about everything else.

It really is an ingenious plan — but they can’t fool me. I know exactly what the Chinese are up to…oh wait look at that cat video, it makes me completely forget about the East China Company.

This article is a work of satire.

Read full story",Shehzad Ghias
