URL,Headline,Date1,Date2,Content,Author
https://tribune.com.pk/story/1410222/guide-pakistani-parents-kill-childs-curiosity/,A guide for Pakistani parents: How to kill your child’s curiosity,2017-05-16T09:34:29 GMT,"Published: May 16, 2017","A helpfu­l guide brough­t to you by the Pakist­an Parent­ing Associ­ation

A helpful guide brought to you by the Pakistan Parenting Association.

Most smart parents know that too much curiosity is a bad thing. Raising a child, especially an inquisitive one, is quite a challenge. We want our child to grow up to be a practical, well-to-do individual with an aura of respect and prestige. We don’t want them to become writers, artists or — Allah-na-keray — philosophers.

Here are a few ways you can keep those pesky questions to the minimum, and raise a successful, practical offspring who will conform to societal standards and make you proud!

1) Protect yourself first

Much like the instruction for oxygen masks on airplanes — protect yourself first, then protect your child. Try not to get yourself sucked into the curiosity trap, and try not to learn too much about the world — the more you know, the more you realize that you know very little, which in turn makes you curious, not unlike the child you are trying to discipline.

Every now and then, you may find yourself in a weak moment, contemplating a new idea for the sake of understanding the world. This is precisely the dangerous behavior you are trying to protect your child from.

Project for out-of-school children launched in Islamabad

Entertaining strange new ideas is like substance abuse — it’s very easy to get carried away. If you aren’t careful, you’ll find yourself interrogating your decades-old, firmly held beliefs that you’ve fought hard to keep intact; beliefs that have now become part of your identity. And your identity is your source of pride, so protect it at all cost.

2) Nip it in the bud

Don’t leave your child’s questions unattended. Childhood curiosity can be tenacious. Not answering the question right away only means the question will pop up again. Now, imagine if you were not around when the question came up. Other adults may encourage your child’s curiosity, or worse, answer your child’s question in a way that is unacceptable to you. The trick, therefore, is to think on your feet, and come up with an easily digestible answer the first time itself. Just make sure the answer does not contradict another unrelated answer you had given earlier. If you do this, be prepared for a volley of questions, precisely what you were avoiding.

Helpful tip: Don’t worry about being logical or realistic. Being the parent, you can literally make your child believe anything you want without much evidence or logic. Use your position in the relationship to your advantage.

3) Obedience

Your most important weapon in the fight against curiosity is obedience. This is a trait you need to inculcate in your child as early as possible. It’ll make things a lot easier for you, your child, and all the authority figures your child will be subjected to in the future — teachers, school administrators, religious authority figures, the government, the police, and the military. For a society, as for a family, to keep functioning the way it’s functioning without disruption, we need obedience. If it wasn’t for obedient children who grew up to become subservient adults, would Pakistan have made the remarkable progress that it has?

Footpath School children in Karachi dance their hearts out

Helpful tip: If you are a father, it helps to think of yourself as the ‘head of state’ and your offspring as the ‘subject’. Own the position — protect it, and make sure you and your position remain significant for a long time. If you are the mother, you are the deputy of the ‘head of state’. Your job is to always support your husband. If you have a difference of opinion with him, just ignore it, and set a good example for your child of how to be obedient.

Another helpful tip: Do not ever apologise if you make a mistake — it undermines your authority as a parent. In fact, according to some thinkers, it’s not a mistake if your heart was in the right place, and as parents, your heart is always in the right place. That’s just a fact. If you cannot resist the urge to apologise, make sure you downplay the mistake, and never use the words ‘mistake’, ‘sorry’ or ‘apologize’.

4) Use the fear of rejection

Tell your child that publicly questioning conventional beliefs will draw ridicule from relatives, friends, and coworkers. If they question things too much, they may even be ostracized. Even if they do so privately, questioning fundamental beliefs can trigger an existential crisis, which, as we all know, leads quickly to suicide. Give them examples of European philosophers, many of whom committed the grave sin of suicide because they wouldn’t stop questioning things.

So, it is best to be safe and not question things at all. Only accept new ideas if they, beyond doubt, support your existing ideas and worldview.

5) School

Don’t worry too much about what your child studies at school; most schools have evolved to feed information to and discipline future job seekers. Even that’s something they struggle to achieve in Pakistan, so there isn’t much to worry about.

Three children used as drug mules rescued

There is a reason schools focus on Physics, Chemistry, Biology, Math and English as opposed to Sociology, Government, Politics, Philosophy and Anthropology. The former are practical subjects that prepare workers of the future to secure jobs and support their families. The latter only get them worked up and upset about perfectly normal things like strictly-defined gender roles.

Occasionally, however, you may come across an idealistic principal or a teacher who has a liberal arts background. They may encourage the inquisitive nature of your child, so avoid educators and schools that have an idealistic inclination.

6) University

Another problematic situation arises when your child is ready to go to university. They may not agree with what you’ve decided for them to study, and may put up resistance. This usually happens if they have gained some emotional and intellectual independence, i.e. they feel it is okay for them to entertain ideas that they know you won’t approve of. This is dangerous territory.

If your child says they want to study literature, philosophy or sociology, you know you’re in trouble. Use whatever tactic you can to dissuade them. If they win, be prepared to deflect questions about your child’s career from inquisitive guests and relatives at weddings and iftar parties. While they go on and on about their son’s amazing job at Unilever, you’ll be struggling to recall what exactly your child does at the newspaper.

To avoid this situation be vigilant from the time your child is born. Keep idealistic relatives away from your child, and be especially vigilant of the child’s older cousins and friends. A category we often take for granted are science geeks — they are practical, smart and usually have jobs, but their ideas can encourage young people to be skeptical, to question conventional thinking, and to stop being intellectually complacent. Engineering graduates in Pakistan typically do not fall into this category, so don’t worry about them.

Find a university for your child that does not admit students from lower socioeconomic backgrounds, or other categories of people you would not want your child to end up marrying. Exposure to the class system can also make a young adult become aware of the glaring inequality in society, and encourage them to question things. Stick with private universities where the environment is devoid of political thought, and students come from largely similar, well-to-do backgrounds. These universities regularly arrange pointless events to keep students busy, and give them a sense of belonging.

Helpful tip: If you feel that the university is too open-minded, or there is too much inter-gender mingling, or the girls are not appropriately dressed, gather other parents and approach the university management. Since you are paying the tuition fee, you are the university’s ultimate customer, not your child. No one understands this better than the university management.

7) Marriage

Try to get your daughters married soon after they graduate from university, and your sons as soon as they find a stable job (unless you need either of them to support you financially). Being unmarried with newfound independence may give your child space to contemplate and entertain interesting new questions, like ‘Why do people have children?’. Be mindful of what they are doing with their income; for example, if they buy too many books, you’re in trouble. So plan ahead and keep your son or daughter occupied with major life events, like their wedding, their first child, their second child… you get the picture.

Helpful tip: Although your child becomes an adult at the age of 18 and can legally do everything that adults can, like owning property, getting married to whoever they choose, and fighting for the country, it is advisable to not highlight the fact that they are now independent adults, much like yourself. Keep using the words larka and larki — as opposed to aadmi and aurat — to refer to young adults, until they get married and have two kids of their own, or until they start looking like they’re 37.

Remember that only the most obedient, practical and self-centered children will make it to the top in our society, bringing their parents immense pride and joy.

This piece is a work of satire.

Read full story",Khurram Siddiqui
https://tribune.com.pk/story/1410238/tv-show-black-mirror-based-pakistan/,If the TV show ‘Black Mirror’ was based in Pakistan,2017-05-16T06:18:20 GMT,"Published: May 16, 2017","The Britis­h televi­sion show deals with the realit­ies of our modern world and we can relate it to Pakist­ani societ­y

KARACHI : Whenever writers, film-makers or artists have explored the idea of a dystopian society, they always talk about it with reference to the future. We always think the worst is yet to come. In a paradoxical antithesis of the idea of hope, we most importantly want to feel safe in the here and now. “It’s alright so far,” we say. But what if it’s not? What if we are merely pretending that it is? What if the future is now and we don’t have to be afraid of the unpleasantness of the future dystopian world because we already live in it and as shocking as it may be, we are comfortable in it.

The increasing anger and frustration of this segmented world, the boiling paranoia of everything we don’t understand, and the technological invasion of our lives has turned us into the very creatures we read about in dystopian literature and feel afraid. “We are not them,” we say. But what if we are?

Gender equality: Educating women a must for enlightened society: Shehbaz

British television show Black Mirror deals with all the realities of our modern world and how we have become what we said we never would: paranoid humanoids who would steal someone’s oxygen to keep themselves alive. We have become the kind who inhales fear and exhales disgust. We live in a world where mob mentality overrules any laws and regulations. In literary dystopias, it is most often the government who is the controlling evil. But in today’s dystopia, it is the people. Mob mentality prevails and sanity is buried somewhere thousands of miles under the mine-filled land of distrust, hatred, and blind rage.

An interesting fact about Black Mirror is that it, in its own twisted way, predicted Trump’s presidency and even told a story of a fictional British prime minister having a ‘very’ close relationship with a pig. Coincidentally, knowledge of an uncorroborated anecdote between actual former British PM David Cameron and a pig was later made public. While the television show has made interesting social commentary on today’s perverted world, we wonder how it would look if it was made in Pakistan. If anything, recent happenings in the country have offered more than a glimpse of the bitter society we live in, and it would be interesting to see how the show’s creator Charlie Brooker would tackle them.

We discuss six recent happenings in Pakistan that would make for brilliant Black Mirror episodes.

We are Mashal Khan: Civil society comes out in support of slain university student

1) Qandeel Baloch’s life

Call her an attention-seeking wannabe model or a symbol for unapologetic independent women, Qandeel Baloch’s life surely fits the bill for a Black Mirror episode. It’s unsurprising, yet interesting to see how social media can change and even end lives. It was social media which hyped, mocked, and made Baloch a celebrity for no reason. It was social media that inadvertently caused her demise. We don’t even need to add fictional elements to make it a Black Mirror episode. A simple biopic with emphasis on the role of the internet and how its influence destroys lives is enough to make us reflect, at least temporarily, on our careless behaviour when we are anonymous. “We didn’t do it. They did,” we say.

2) Mashal Khan incident

The fact that Mashal Khan was brutally murdered not by the ‘lesser educated’ (generally believed to be more extremist-adjacent) but rather his own fellow university students and faculty, is evidence enough that education and technology don’t change man’s inherently violent nature. If anything, it merely enhances it and gives it different ways to implement it. We have moved on from swords and spears to guns and missiles. Yet, Khan’s story reminds us of our animal nature where a quick death isn’t enough to satisfy us.

It’s a classic case of mob mentality overpowering the general rules of a civilised society.

Imagine a world where it was legal for people to murder and maim anyone they perceive as guilty of a crime. What would become of the society where purging of sanity was encouraged?

Mardan university student accused of blasphemy beaten to death on campus

3) Yasir Hussain’s child molestation joke

Yasir Hussain caught heat when he made his life’s biggest mistake by joking about child molestation at a recent award’s show. Sitting comfortable in his home, he apologised and was largely forgiven. A couple of weeks later, the incident is largely forgotten as we dwell on our latest obsession. With our short attention spans, that’s what we do. We raise our voice on one issue, forget about it the next day and move on. But what if those twitter warriors were actually willing to go farther than typing 140 characters?

PHOTO: FILE

Imagine a world where governments don’t exist and all conflicts are solved by public trials where angry people decide what to do. Hussain would not go forgiven from the trial, even after hundreds of apologies. It’s cruel to imagine what would come of him, but it won’t be a surprise, given this is the direction we’re headed toward as a society.

4) Waqar Zaka’s beatdown

This may seem eerily similar to Black Mirror’s ’15 Million Merits’ episode from the first season. Television ratings and online views are all the rage. Brands, corporate companies and channels are willing to spend money on anything that goes viral. In the aforementioned episode, Bing’s rant about being sick of the slave-like society powered by ratings and constant distraction through entertainment shockingly earns him a television show of his own. Zaka’s incident may or may not have earned him sympathy or a new television show (along with his attacker), but it did earn him thousands of views, which translate as free publicity. It served as a good distraction for people and now it’s largely forgotten about. What if the entire episode with Zaka, his beatdown, and the eventual resolution of the conflict with his attacker landed him a series? It would not be far-fetched to think it could happen. In this day and age, free publicity (positive or negative) is like winning a jackpot. You’re sure to become popular for 15 minutes, or could end up drowning in your 15 million rupees.

5) Naureen Laghari

A medical student, Naureen Laghari made headlines last month when she was captured for being involved with ISIS. An educated girl from the province which is a symbol of peace and love and Sufi scholars had joined ISIS and was set to suicide attack a church on Easter. She allegedly met a man through Facebook who lured her into joining the group. She disappeared, travelled to Syria, married another terrorist and returned to Pakistan to carry out her mission. The potential Black Mirror episode could revolve around her family and friends trying to find her, and the mystery of what urged Laghari to go in that direction.

6) Ramazan ban on eating/drinking in public

Religion is a personal matter. The entire point of fasting is to not be affected by the tempting surroundings. If we are to remove the temptations in our surroundings, then what’s the point of fasting anyway?

It does not test a Muslim’s faith and actually shows how weak it is. We don’t even need to imagine a world where eating and drinking is banned during Ramazan because it’s happening right here. What you can imagine is the suffering of all those who can’t fast – elderly, sick, pregnant women, children, and how this ban will affect them. With the scorching heat waves this region is known for, it is bound to end with people dying due to dehydration and other factors. The ridiculousness and unsurprising level of public support for the ban screams Black Mirror at this point. I wonder how it would go down if a hungry child or elderly person falls victim to a mob.

Couple gets death over ‘blasphemous’ text message

This is sadly the dark truth of our fearful society. We go to curb anything and everything to protect our convictions. As we go about our lives mocking a stranger online or fighting our friend for questioning authority or common beliefs, we need to understand that the black mirror of our cellphones and laptops is actually showing a truer reflection of us than the dressing table mirrors.

Have something to add to the story? Share it in the comments below.

Read full story",Rahul Aijaz
https://tribune.com.pk/story/1375867/denying-entry-pakistani-fulbright-scholar-major-victory-war-terror-us/,Denying entry to Pakistani Fulbright scholar major victory in war on terror: US,2017-04-06T10:24:21 GMT,"Published: April 6, 2017","US expose­s Pakist­an’s grand plan to bring down their countr­y by export­ing academ­ic terror­ists

Our cover has finally been blown. For decades, Pakistani students have managed to sneak their way into the United States secretly pouring millions of dollars in education fees into the US economy and adding diversity to their college programmes. For decades, top Pakistani brains have made sufficient breakthroughs in academic research in the US adding to their college departments. For decades, brilliant Pakistani professionals have graduated from top US universities to diversify and innovate the US markets.

But all this terrorism will now come to an end. The US finally realised our grand plan to bring down their country by developing their economy and opening up emerging markets for them.

Pakistani Fulbright scholar denied entry into the US despite valid visa

We were once the second-fastest growing and the seventh-largest ethnic group in the United States but clearly, we were just mooching off Uncle Sam and contributed absolutely nothing to the country. About 500,000 Pakistanis just sitting on the couch eating American doughnuts and planning the next terrorist attack in the country – it’s just that Pakistanis are lazy which is why 500,000 people have only managed a handful of terrorist attacks in the last two decades.

A Pakistani even almost managed to get a US President elected. Huma Abedin would have finally managed to put Hilary Clinton – an ISI agent – in the White House, thus fulfilling the decade-long Pakistani plan to infiltrate the upper echelons of the states.

Hillary takes a leaf out of Imran Khan’s playbook

We were so close – in Saqib Ali, Ali Sajjad Taj, Arif Alikhan, Shamila N Chaudhry we had mayors, advisors, delegates and representatives. They would have all come together at the right time to summon Captain Pakistan – he’s the superhero who is going to bring the US down to zero. Saghir Tahir even managed to get elected on a Republican Party ticket – a Pakistani-Muslim elected representative in the Republican Party? That would be like Bernie Sanders being named the new khalifa of ISIS.

Clearly, Pakistani academics have contributed nothing to the United States and all these people are simply terrorists in the making. I applaud the decision of the US to deny entry into the US to Zia Shah, a Fulbright scholar. Zia Shah wanted to teach empathy, well how can he do that without having faced extreme prejudice himself? If anything, the US is helping him experience something crucial to his education and training work. One must face extremism to help others facing extremism.

All his work in developing peace and empathy would have led to so much terrorism. We all know peace is only a euphemism for war – why else would the US claim to be the most peace-loving nation in the world? You want some peace? Here are some bombs instead.

Now Donald Trump is here to put an end to all this academic terrorism being exported from Pakistan. It is time to make the Fulbright program fully dim. No more H-1B visas for the top of class graduates, no more opportunities to bring their unique expertise and specialisation to America and no more curry. Face it, if it wasn’t for Britain and America, we would not even have curry. No Pakistani in Pakistan has ever had curry or naan bread – which by the way is just naan! That would be like calling it chai tea – wait a minute Starbucks does have a chai tea option.

Pakistan doesn’t need Starbucks

If Pakistanis didn’t want to become terrorists, why would they learn chemistry and aeronautical engineering in America? All these academics are simply pretending to be peace-loving. They are all covert spies. As soon as the global call to jihad happens Akbar S Ahmed will leave anthropology and raise havoc on America like The Mummy Returns – it will be a bigger disaster than Brendan Fraser’s career.

Ayesha Jalal will stop teaching history at Tufts University and start making the United States itself history. Adil Najam will leave teaching Geography and work towards wrecking geography – the Grand Canyon is about to get so much wider.

Farooq Azam will leave marine microbiology and accept his real secret identity – Pakistani Aquaman. Some time ago, he had to apply for asylum in the United States after he was repeatedly hunted by Baloch fishermen off the coast of Karachi.

10 ways to enter the United States if you’re a Muslim

Saleem H Ali will stop researching the environment and start working on destroying it. But wait, Trump already has that covered so we Pakistanis can do what we love doing the most – just sit back and watch doing nothing.

We all know ISIS simply stands for Islamabad School of Institutional Scoundrels. It’s about time we stop exporting these academic terrorists. These vile creatures are allowed to do their work here; maybe build a few more universities and colleges here too while they are at it.

This article is a work of satire.

Read full story",Shehzad Ghias
